{
  "documentKind": "hair-evidence-manifest",
  "schemaVersion": "0.1.0",
  "targetDevice": {
    "id": "CH32V203G6U6",
    "name": "CH32V203G6U6",
    "vendor": "WCH",
    "family": "CH32V203",
    "variant": "G6U6",
    "package": "QFN28",
    "architecture": "QingKe V4B",
    "notes": "Exact target selected from the user's QT Py CH32V203 request after clarifying that the manifest should target the MCU rather than the board. Adafruit board collateral is internally inconsistent about G6 versus G8, so this manifest uses the user-approved CH32V203G6U6 exact variant backed by the exact-variant ch32-data entry and by Adafruit's G6/32KB wording."
  },
  "sources": [
    {
      "id": "wch-ch32v203-datasheet",
      "kind": "datasheet",
      "uri": "https://www.wch.cn/downloads/CH32V203DS0_PDF.html",
      "notes": "Official WCH CH32V203 family datasheet. Best authoritative source for exact-variant identity, package, memory sizing, feature inventory, and electrical coverage for CH32V203G6U6."
    },
    {
      "id": "wch-ch32fv2x-v3x-rm",
      "kind": "reference-manual",
      "uri": "https://www.wch.cn/downloads/CH32FV2x_V3xRM_PDF.html",
      "notes": "Official WCH family reference manual for CH32V2x/V3x peripherals and registers. Primary source for register structure, fields, clocks, resets, and peripheral semantics."
    },
    {
      "id": "openwch-ch32v20x-sdk",
      "kind": "sdk",
      "uri": "https://github.com/openwch/ch32v20x/tree/804daf39a21af99be64c5abe0ea4bdaf361eb2e4",
      "version": "804daf39a21af99be64c5abe0ea4bdaf361eb2e4",
      "notes": "Official openwch repository with SDK material, examples, headers, startup code, and package-group assets for the CH32V20x family."
    },
    {
      "id": "openwch-ch32v20x-header",
      "kind": "vendor-header",
      "uri": "https://raw.githubusercontent.com/openwch/ch32v20x/804daf39a21af99be64c5abe0ea4bdaf361eb2e4/EVT/EXAM/SRC/Peripheral/inc/ch32v20x.h",
      "version": "V1.0.1",
      "notes": "Official WCH peripheral access header. The CH32V20x_D6 grouping explicitly includes CH32V203G6 and provides IRQ names, TIM4 register layout, base addresses, and peripheral type definitions."
    },
    {
      "id": "openwch-ch32v20x-core-header",
      "kind": "vendor-header",
      "uri": "https://raw.githubusercontent.com/openwch/ch32v20x/804daf39a21af99be64c5abe0ea4bdaf361eb2e4/EVT/EXAM/SRC/Core/core_riscv.h",
      "version": "V1.0.1",
      "notes": "Official WCH core header defining the PFIC register layout, base address, NVIC_KEY3, and the NVIC_SystemReset write sequence."
    },
    {
      "id": "openwch-ch32v20x-startup-d6",
      "kind": "source-code",
      "uri": "https://raw.githubusercontent.com/openwch/ch32v20x/804daf39a21af99be64c5abe0ea4bdaf361eb2e4/EVT/EXAM/SRC/Startup/startup_ch32v20x_D6.S",
      "version": "V1.0.2",
      "notes": "Official WCH startup file for the D6 subset that includes CH32V203G6. Useful to cross-check interrupt vector ordering, D6 subgroup membership, and the single shared TIM4_IRQHandler vector."
    },
    {
      "id": "openwch-ch32v20x-tim-h",
      "kind": "vendor-header",
      "uri": "https://raw.githubusercontent.com/openwch/ch32v20x/804daf39a21af99be64c5abe0ea4bdaf361eb2e4/EVT/EXAM/SRC/Peripheral/inc/ch32v20x_tim.h",
      "version": "V1.0.1",
      "notes": "Official WCH timer library header. Names the TIM update, compare, and trigger interrupt bits plus preload, update-source, and software-event constants needed to bind a timer-backed Embassy time driver."
    },
    {
      "id": "openwch-ch32v20x-tim-c",
      "kind": "source-code",
      "uri": "https://raw.githubusercontent.com/openwch/ch32v20x/804daf39a21af99be64c5abe0ea4bdaf361eb2e4/EVT/EXAM/SRC/Peripheral/src/ch32v20x_tim.c",
      "version": "V1.0.1",
      "notes": "Official WCH timer library implementation. Proves the concrete interrupt-enable, pending, clear, compare-register, and software-event semantics used by TIM2-TIM4."
    },
    {
      "id": "openwch-ch32v20x-adc-dma-example",
      "kind": "source-code",
      "uri": "https://raw.githubusercontent.com/openwch/ch32v20x/804daf39a21af99be64c5abe0ea4bdaf361eb2e4/EVT/EXAM/ADC/ADC_DMA/User/main.c",
      "version": "V1.0.1",
      "notes": "Official WCH ADC DMA example for the CH32V20x family. Useful to ground the ADC1 DMA path and transfer direction without relying on community inference."
    },
    {
      "id": "openwch-ch32v20x-tim-dma-example",
      "kind": "source-code",
      "uri": "https://raw.githubusercontent.com/openwch/ch32v20x/804daf39a21af99be64c5abe0ea4bdaf361eb2e4/EVT/EXAM/TIM/TIM_DMA/User/main.c",
      "version": "V1.0.1",
      "notes": "Official WCH timer DMA example for the CH32V20x family. Useful to ground at least one concrete timer DMA route and direction."
    },
    {
      "id": "openwch-ch32v20x-tim-int-example",
      "kind": "source-code",
      "uri": "https://raw.githubusercontent.com/openwch/ch32v20x/804daf39a21af99be64c5abe0ea4bdaf361eb2e4/EVT/EXAM/TIM/TIM_INT/User/main.c",
      "version": "V1.0.0",
      "notes": "Official WCH timer interrupt example. Although it uses TIM1, it shows the vendor-supported sequence for time-base init, pending clear, NVIC enable, interrupt enable, and optional software-generated update events."
    },
    {
      "id": "openwch-ch32v20x-output-compare-example",
      "kind": "source-code",
      "uri": "https://raw.githubusercontent.com/openwch/ch32v20x/804daf39a21af99be64c5abe0ea4bdaf361eb2e4/EVT/EXAM/TIM/Output_Compare_Mode/User/main.c",
      "version": "V1.0.1",
      "notes": "Official WCH output-compare example. Although it uses TIM1, it shows vendor-supported compare-register programming and ARR/OC preload configuration relevant to compare-based alarms."
    },
    {
      "id": "qingke-v4-processor-manual",
      "kind": "other",
      "uri": "https://www.wch.cn/downloads/QingKeV4_Processor_Manual_PDF.html",
      "notes": "Official architecture-level QingKe V4 processor manual referenced by the openwch material. Useful when core and exception behavior are underspecified in the family datasheet and reference manual."
    },
    {
      "id": "ch32-rs-ch32v203xx-svd",
      "kind": "svd",
      "uri": "https://raw.githubusercontent.com/ch32-rs/ch32-rs/9b4ee66500b956bc87fbf83aa28ad245b39ebd15/svd/vendor/CH32V203xx.svd",
      "version": "9b4ee66500b956bc87fbf83aa28ad245b39ebd15",
      "notes": "Community-maintained CH32V203 family SVD from ch32-rs. Not vendor-authored, but useful as an auditable metadata-rich gap-filler for register descriptions, reset values, field descriptions, and access metadata."
    },
    {
      "id": "ch32-rs-ch32v203g6u6-yaml",
      "kind": "generated",
      "uri": "https://raw.githubusercontent.com/ch32-rs/ch32-data/a515903589cfbc342dc6ad0d13c02b4382da5628/data/chips/CH32V203G6U6.yaml",
      "version": "a515903589cfbc342dc6ad0d13c02b4382da5628",
      "notes": "Community-curated exact-variant machine-readable chip description for CH32V203G6U6. Useful as an exact-variant cross-check for package, memory sizing, device id, and included peripheral fragments."
    },
    {
      "id": "adafruit-qt-py-ch32v203-schematic",
      "kind": "source-code",
      "uri": "https://raw.githubusercontent.com/adafruit/Adafruit-QT-Py-CH32V203-PCB/c5c1580d9823d2f8923778530339179531d024f6/Adafruit%20QT%20Py%20CH32V203.sch",
      "version": "c5c1580d9823d2f8923778530339179531d024f6",
      "notes": "Commit-pinned Adafruit Eagle schematic for the QT Py CH32V203 board. Used only for board-specific connector, header, and NeoPixel wiring facts, not for authoritative MCU pin identity."
    },
    {
      "id": "adafruit-qt-py-ch32v203-overview",
      "kind": "other",
      "uri": "https://learn.adafruit.com/adafruit-qt-py-ch32v203/overview.md",
      "notes": "Adafruit Learn overview page describing the USB-C connector, native USB device / TinyUSB CDC support, RGB NeoPixel, and USB bootloader workflow at board level."
    },
    {
      "id": "adafruit-qt-py-ch32v203-pinouts",
      "kind": "other",
      "uri": "https://learn.adafruit.com/adafruit-qt-py-ch32v203/pinouts.md",
      "notes": "Adafruit Learn pinouts page describing the board-level PA2/PA3 UART header roles and the onboard NeoPixel connection to PA4."
    },
    {
      "id": "wch-cnblogs-bldc-tim4-article",
      "kind": "human-annotation",
      "uri": "https://www.cnblogs.com/wchmcu/p/17678923.html",
      "notes": "Blog园 post by WCH_CH32 with directly TIM4-specific code snippets, including a shared TIM4_IRQHandler and TIM_IT_Trigger|TIM_IT_CC1 usage. Lower authority than the official SDK and included only as a gap-filler for TIM4-specific interrupt usage."
    }
  ]
}
