{
  "documentKind": "hair-evidence-manifest",
  "schemaVersion": "0.1.0",
  "targetDevice": {
    "id": "CH32V203C8T6",
    "name": "CH32V203C8T6",
    "vendor": "WCH",
    "family": "CH32V203",
    "variant": "C8T6",
    "package": "LQFP48",
    "architecture": "QingKe V4B",
    "notes": "Exact target variant selected by the user. WCH appears to publish family-level documentation for CH32V20x/30x rather than a C8T6-only datasheet/reference manual."
  },
  "sources": [
    {
      "id": "wch-ch32v20x-30x-datasheet",
      "kind": "datasheet",
      "uri": "https://www.wch-ic.com/downloads/CH32V20x_30xDS0_PDF.html",
      "notes": "Official WCH family datasheet for CH32V20x/30x devices. Primary source for device identity, package/pinout, electrical and feature coverage for CH32V203C8T6."
    },
    {
      "id": "wch-ch32fv2x-v3x-rm",
      "kind": "reference-manual",
      "uri": "https://www.wch-ic.com/downloads/CH32FV2x_V3xRM_PDF.html",
      "notes": "Official WCH family reference manual covering CH32V2x/V3x peripherals and registers. Primary source for register structure, fields, clocks, resets, and peripheral semantics."
    },
    {
      "id": "openwch-ch32v20x-sdk",
      "kind": "sdk",
      "uri": "https://github.com/openwch/ch32v20x/tree/804daf39a21af99be64c5abe0ea4bdaf361eb2e4",
      "version": "804daf39a21af99be64c5abe0ea4bdaf361eb2e4",
      "notes": "Official openwch repository with SDK material, examples, headers, startup code, and package-specific project assets for CH32V20x family devices."
    },
    {
      "id": "openwch-ch32v20x-header",
      "kind": "vendor-header",
      "uri": "https://raw.githubusercontent.com/openwch/ch32v20x/804daf39a21af99be64c5abe0ea4bdaf361eb2e4/EVT/EXAM/SRC/Peripheral/inc/ch32v20x.h",
      "version": "V1.0.1",
      "notes": "Official WCH peripheral access header. The CH32V20x_D6 grouping explicitly includes CH32V203C8 and is useful for IRQ names, peripheral types, and register definitions."
    },
    {
      "id": "openwch-ch32v20x-core-header",
      "kind": "vendor-header",
      "uri": "https://raw.githubusercontent.com/openwch/ch32v20x/804daf39a21af99be64c5abe0ea4bdaf361eb2e4/EVT/EXAM/SRC/Core/core_riscv.h",
      "version": "V1.0.1",
      "notes": "Official WCH core header defining the PFIC register layout, base address, NVIC_KEY3, and the NVIC_SystemReset write sequence."
    },
    {
      "id": "openwch-ch32v20x-startup-d6",
      "kind": "source-code",
      "uri": "https://raw.githubusercontent.com/openwch/ch32v20x/804daf39a21af99be64c5abe0ea4bdaf361eb2e4/EVT/EXAM/SRC/Startup/startup_ch32v20x_D6.S",
      "version": "V1.0.2",
      "notes": "Official WCH startup file for the D6 subset that includes CH32V203C8. Useful to cross-check exception and interrupt vector ordering."
    },
    {
      "id": "openwch-ch32v20x-adc-dma-example",
      "kind": "source-code",
      "uri": "https://raw.githubusercontent.com/openwch/ch32v20x/804daf39a21af99be64c5abe0ea4bdaf361eb2e4/EVT/EXAM/ADC/ADC_DMA/User/main.c",
      "version": "V1.0.1",
      "notes": "Official WCH ADC DMA example for the CH32V20x family. Grounds the ADC1 regular-conversion DMA path as DMA1_Channel1 in peripheral-to-memory direction, but does not demonstrate ADC2 DMA."
    },
    {
      "id": "openwch-ch32v20x-tim-dma-example",
      "kind": "source-code",
      "uri": "https://raw.githubusercontent.com/openwch/ch32v20x/804daf39a21af99be64c5abe0ea4bdaf361eb2e4/EVT/EXAM/TIM/TIM_DMA/User/main.c",
      "version": "V1.0.1",
      "notes": "Official WCH timer DMA example for the CH32V20x family. Grounds TIM1 update-triggered DMA to TIM1_CH1CVR on DMA1_Channel5 in memory-to-peripheral direction for PWM output, but does not cover every timer DMA request line."
    },
    {
      "id": "qingke-v4-processor-manual",
      "kind": "other",
      "uri": "https://www.wch-ic.com/downloads/QingKeV4_Processor_Manual_PDF.html",
      "notes": "Official architecture-level processor manual referenced by the openwch datasheet README. Useful for core and exception behavior not fully explained in the device-family manuals."
    },
    {
      "id": "ch32-rs-ch32v203xx-svd",
      "kind": "svd",
      "uri": "https://raw.githubusercontent.com/ch32-rs/ch32-rs/9b4ee66500b956bc87fbf83aa28ad245b39ebd15/svd/vendor/CH32V203xx.svd",
      "version": "9b4ee66500b956bc87fbf83aa28ad245b39ebd15",
      "notes": "Community-maintained CH32V203 family SVD from ch32-rs. Not affiliated with WCH, but metadata-rich and useful as an auditable gap-filler for register descriptions, reset values, field descriptions, and some field access semantics when the official manuals and headers are too sparse."
    },
    {
      "id": "ch32-rs-ch32v203c8t6-yaml",
      "kind": "generated",
      "uri": "https://raw.githubusercontent.com/ch32-rs/ch32-data/a515903589cfbc342dc6ad0d13c02b4382da5628/data/chips/CH32V203C8T6.yaml",
      "version": "a515903589cfbc342dc6ad0d13c02b4382da5628",
      "notes": "Community-curated exact-variant machine-readable chip description from ch32-data. The project states its data is manually created and curated from official datasheets, MounRiver-distributed SVD files, and openwch material, making it a useful structured cross-check and provenance trail for community-derived metadata."
    }
  ]
}
